{
  "$schema": "./data.config.schema.json",
  "seed": 42,
  "periodDays": 90,
  "categories": 6,
  "products": 60,
  "customers": 30,
  "employees": 4,
  "admins": 1,
  "addressesPerCustomer": 2,
  "orders": 150,
  "orderChangeRequests": 8,
  "reviews": 120,
  "wishlistItems": 40,
  "cartItems": 20,
  "coupons": 5,
  "couponRedemptions": 25,
  "promotions": 3,
  "stockMovements": 200,
  "distributionCenters": 2,
  "banners": 3,
  "navItems": 6,
  "notifications": 30,
  "auditLogs": 150,
  "pageViews": 2000
}
